{
  "$schema": "schemas/dslraid-verification-evidence.schema.json",
  "schema_version": "0.1.0",
  "generated_by": "scripts/verificationevidencegen.sh",
  "subject": "verify:daemon",
  "ssot": "lisp/agent/verification.lisp",
  "form": "(verify daemon (lint) (unit-test) (integration-test) (conformance) (release-check))",
  "ontology_chain": [
    "ontology",
    "executable-ssot",
    "verification-graph",
    "codegen"
  ],
  "generated_backends": [
    {"backend": "github-actions", "output": ".github/workflows/verification.yml", "generator": "scripts/workflowgen.sh", "check": "scripts/workflowgen.sh check"},
    {"backend": "github-ci", "output": ".github/workflows/ci.yml", "generator": "scripts/cigen.sh", "check": "scripts/cigen.sh check"},
    {"backend": "github-golden", "output": ".github/workflows/golden.yml", "generator": "scripts/goldengen.sh", "check": "scripts/goldengen.sh check"},
    {"backend": "github-security", "output": ".github/workflows/security.yml", "generator": "scripts/securityworkflowgen.sh", "check": "scripts/securityworkflowgen.sh check"},
    {"backend": "github-pages", "output": ".github/workflows/pages.yml", "generator": "scripts/pagesworkflowgen.sh", "check": "scripts/pagesworkflowgen.sh check"},
    {"backend": "gitlab-ci", "output": ".gitlab-ci.yml", "generator": "scripts/gitlabgen.sh", "check": "scripts/gitlabgen.sh check"},
    {"backend": "local-makefile", "output": "Makefile", "generator": "scripts/makegen.sh", "check": "scripts/makegen.sh check"},
    {"backend": "bazel", "output": "BUILD.bazel", "generator": "scripts/bazelgen.sh", "check": "scripts/bazelgen.sh check"},
    {"backend": "github-release", "output": ".github/workflows/release.yml", "generator": "scripts/releasegen.sh", "check": "scripts/releasegen.sh check"},
    {"backend": "privacy-manifest", "output": "docs/generated/verification-privacy.json", "generator": "scripts/verificationprivacygen.sh", "check": "scripts/verificationprivacygen.sh check"},
    {"backend": "pdca-manifest", "output": "docs/generated/verification-pdca.json", "generator": "scripts/verificationpdcagen.sh", "check": "scripts/verificationpdcagen.sh check"},
    {"backend": "evidence-ops", "output": "docs/generated/verification-evidence-ops.json", "generator": "scripts/verificationevidenceopsgen.sh", "check": "scripts/verificationevidenceopsgen.sh check"},
    {"backend": "loss-ledger", "output": "docs/generated/verification-loss-ledger.json", "generator": "scripts/verificationlossgen.sh", "check": "scripts/verificationlossgen.sh check"},
    {"backend": "semantic-hash", "output": "docs/generated/verification-semantic-hash.json", "generator": "scripts/verificationsemanticgen.sh", "check": "scripts/verificationsemanticgen.sh check"},
    {"backend": "semantic-diff", "output": "docs/generated/verification-semantic-diff.json", "generator": "scripts/verificationdiffgen.sh", "check": "scripts/verificationdiffgen.sh check"},
    {"backend": "authority-manifest", "output": "docs/generated/verification-authority.json", "generator": "scripts/verificationauthoritygen.sh", "check": "scripts/verificationauthoritygen.sh check"},
    {"backend": "access-policy", "output": "docs/generated/verification-access-policy.json", "generator": "scripts/verificationaccessgen.sh", "check": "scripts/verificationaccessgen.sh check"},
    {"backend": "reasoning-access", "output": "docs/generated/verification-reasoning-access.json", "generator": "scripts/verificationreasoninggen.sh", "check": "scripts/verificationreasoninggen.sh check"},
    {"backend": "reliability-registry", "output": "docs/generated/verification-reliability.json", "generator": "scripts/verificationreliabilitygen.sh", "check": "scripts/verificationreliabilitygen.sh check"},
    {"backend": "agreement-manifest", "output": "docs/generated/verification-agreement.json", "generator": "scripts/verificationagreementgen.sh", "check": "scripts/verificationagreementgen.sh check"},
    {"backend": "adversarial-review", "output": "docs/generated/verification-adversarial-review.json", "generator": "scripts/verificationadversarialgen.sh", "check": "scripts/verificationadversarialgen.sh check"},
    {"backend": "evidence-quality", "output": "docs/generated/verification-evidence-quality.json", "generator": "scripts/verificationevidencequalitygen.sh", "check": "scripts/verificationevidencequalitygen.sh check"},
    {"backend": "lease-manifest", "output": "docs/generated/verification-lease.json", "generator": "scripts/verificationleasegen.sh", "check": "scripts/verificationleasegen.sh check"},
    {"backend": "review-capacity", "output": "docs/generated/verification-review-capacity.json", "generator": "scripts/verificationreviewgen.sh", "check": "scripts/verificationreviewgen.sh check"},
    {"backend": "feedback-closure", "output": "docs/generated/verification-feedback.json", "generator": "scripts/verificationfeedbackgen.sh", "check": "scripts/verificationfeedbackgen.sh check"},
    {"backend": "quarantine-manifest", "output": "docs/generated/verification-quarantine.json", "generator": "scripts/verificationquarantinegen.sh", "check": "scripts/verificationquarantinegen.sh check"},
    {"backend": "confidence-manifest", "output": "docs/generated/verification-confidence.json", "generator": "scripts/verificationconfidencegen.sh", "check": "scripts/verificationconfidencegen.sh check"},
    {"backend": "sidecar-manifest", "output": "docs/generated/verification-sidecar.json", "generator": "scripts/verificationsidecargen.sh", "check": "scripts/verificationsidecargen.sh check"},
    {"backend": "orchestration-manifest", "output": "docs/generated/verification-orchestration.json", "generator": "scripts/verificationorchestrationgen.sh", "check": "scripts/verificationorchestrationgen.sh check"},
    {"backend": "control-plane-verifier", "output": "docs/generated/verification-control-plane.json", "generator": "scripts/verificationcontrolgen.sh", "check": "scripts/verificationcontrolgen.sh check"},
    {"backend": "shadow-orchestrator", "output": "docs/generated/verification-shadow-orchestrator.json", "generator": "scripts/verificationshadowgen.sh", "check": "scripts/verificationshadowgen.sh check"},
    {"backend": "provider-compat", "output": "docs/generated/verification-provider-compat.json", "generator": "scripts/verificationprovidergen.sh", "check": "scripts/verificationprovidergen.sh check"},
    {"backend": "runtime-trace", "output": "docs/generated/verification-runtime-trace.json", "generator": "scripts/verificationruntimegen.sh", "check": "scripts/verificationruntimegen.sh check"},
    {"backend": "runtime-contract", "output": "docs/generated/verification-runtime-contract.json", "generator": "scripts/verificationruntimecontractgen.sh", "check": "scripts/verificationruntimecontractgen.sh check"},
    {"backend": "domain-fsm-dsl", "output": "docs/generated/verification-domain-fsm.json", "generator": "scripts/verificationdomainfsmgen.sh", "check": "scripts/verificationdomainfsmgen.sh check"},
    {"backend": "query-surface", "output": "docs/generated/verification-query-surface.json", "generator": "scripts/verificationquerygen.sh", "check": "scripts/verificationquerygen.sh check"},
    {"backend": "run-manifest", "output": "docs/generated/verification-run-manifest.json", "generator": "scripts/verificationrunmanifestgen.sh", "check": "scripts/verificationrunmanifestgen.sh check"},
    {"backend": "bootstrap-sequence", "output": "docs/generated/verification-bootstrap-sequence.json", "generator": "scripts/verificationbootstrapgen.sh", "check": "scripts/verificationbootstrapgen.sh check"},
    {"backend": "experiment-loop", "output": "docs/generated/verification-experiment-loop.json", "generator": "scripts/verificationexperimentgen.sh", "check": "scripts/verificationexperimentgen.sh check"},
    {"backend": "merge-readiness", "output": "docs/generated/verification-merge-readiness.json", "generator": "scripts/verificationmergegen.sh", "check": "scripts/verificationmergegen.sh check"},
    {"backend": "merge-automation", "output": "docs/generated/verification-merge-automation.json", "generator": "scripts/verificationautomergegen.sh", "check": "scripts/verificationautomergegen.sh check"},
    {"backend": "branch-protection", "output": "docs/generated/verification-branch-protection.json", "generator": "scripts/verificationbranchgen.sh", "check": "scripts/verificationbranchgen.sh check"},
    {"backend": "actions-receipt", "output": "docs/generated/verification-actions-receipt.json", "generator": "scripts/verificationreceiptgen.sh", "check": "scripts/verificationreceiptgen.sh check"},
    {"backend": "source-shape", "output": "docs/generated/verification-source-shape.json", "generator": "scripts/verificationsourcegen.sh", "check": "scripts/verificationsourcegen.sh check"},
    {"backend": "objective-coverage", "output": "docs/generated/verification-objective-coverage.json", "generator": "scripts/verificationobjectivegen.sh", "check": "scripts/verificationobjectivegen.sh check"},
    {"backend": "adr-governance", "output": "docs/generated/verification-adr-governance.json", "generator": "scripts/verificationadrgen.sh", "check": "scripts/verificationadrgen.sh check"},
    {"backend": "backend-parity", "output": "docs/generated/verification-backend-parity.json", "generator": "scripts/verificationparitygen.sh", "check": "scripts/verificationparitygen.sh check"},
    {"backend": "execution-projection", "output": "docs/generated/verification-execution-projection.json", "generator": "scripts/verificationprojectiongen.sh", "check": "scripts/verificationprojectiongen.sh check"},
    {"backend": "github-actions-suite", "output": "docs/generated/verification-github-actions.json", "generator": "scripts/verificationactionsgen.sh", "check": "scripts/verificationactionsgen.sh check"},